{
  "schemaVersion": "1.0",
  "promotionDecisionId": "vm31-2026-current-manual-promotion-2026-08-28",
  "decisionDate": "2026-08-28",
  "decision": "approved_for_canonical_promotion",
  "scope": {
    "scopeId": "vm31-2026-current-manual",
    "sourceEditionId": "NAIC-VALUATION-MANUAL-2026",
    "sourceVersionIdentifier": "2026 NAIC Valuation Manual",
    "sourceSha256": "496cab9f387c84971df69eab1528d93aea70f7e57c8429661f2765498b38d4e9",
    "sourceIds": [
      "vm31-current-manual"
    ],
    "expectedChunkCount": 84,
    "includedInformationTypes": [
      "current_manual_reporting_and_documentation_requirements",
      "purpose_and_applicability_context",
      "complete_numbered_requirements_and_qualifiers",
      "guidance_notes",
      "certifications_and_supporting_exhibits",
      "explicit_cross_reference_metadata",
      "closing_boundary_control"
    ]
  },
  "reviewEvidence": {
    "reviewPackagePath": "data/processed/review_packages/vm31-canonical-coverage-review-package.json",
    "sourceQaPath": "data/processed/review_packages/vm31-source-qa.json",
    "retrievalQaPath": "data/processed/review_packages/vm31-focused-retrieval-evaluation.json",
    "blockersClosed": true,
    "independentReviewRecorded": true,
    "notes": "The final independent review approved canonical promotion after the complete source, hierarchy, retrieval, authority, support-gate, metadata, relationship-provenance, and validator-implementation review cycle. The byte-exact validator evidence reviewed before promotion remains at data/processed/review_packages/vm31-validator-implementation-review/manifest.json."
  },
  "exclusions": [
    "The 92 VM-31 explicit-reference relationship candidates, which remain pending, review-only, not promoted, and not promotion-eligible",
    "Historical, proposed, companion, and practice-note material outside the reviewed current 2026 VM-31 package",
    "Any source or chunk outside vm31-current-manual",
    "Learner-facing, application, RAG, vector, and Copilot export approval"
  ],
  "downstreamEligibility": {
    "learnerFacingAllowed": false,
    "appReadyAllowed": false,
    "ragReadyAllowed": false,
    "copilotExportEligible": false,
    "reason": "Canonical source promotion and downstream publication, retrieval-production, vector, or Copilot export approval are separate governance decisions."
  },
  "reviewerRecord": {
    "identityRecorded": false,
    "identity": null,
    "note": "The supplied final independent-review disposition records approval but does not provide a reviewer identity; no identity is inferred."
  },
  "preservation": {
    "sourceTextChanged": false,
    "chunkContentChanged": false,
    "reviewHistoryPreserved": true,
    "note": "Promotion changes governance metadata only. The 84 source excerpts, source-text hashes, page citations, IDs, hierarchy, adjacency, reporting classifications, and focused retrieval results remain unchanged."
  }
}
